{"boundary":{"cell_ids":["12345678-1234-4000-8000-00000000000b"],"kind":"surface_flux","unit":"W/m2","value":8},"cad_face_ids":["12345678-1234-4000-8000-00000000001e"],"capability":"spatial-linear-vertex-v2","cells":[{"id":"12345678-1234-4000-8000-00000000000a","order":1,"topology":"tet4","vertices":[0,1,2,3]},{"id":"12345678-1234-4000-8000-00000000000b","order":1,"topology":"tri3","vertices":[0,2,1]}],"contract_version":"2.0.0","execution_mode":"fcst_native","fields":[{"components":["scalar"],"entity_ids":["12345678-1234-4000-8000-000000000004","12345678-1234-4000-8000-000000000003","12345678-1234-4000-8000-000000000002","12345678-1234-4000-8000-000000000001"],"frame_id":"12345678-1234-4000-8000-000000000014","location":"mesh_vertex","projection":"raw","provenance":"56e358a8af453fb0775c5e1ac4dc3c9c0b396ab2e7f3fc8c72813ac948bc76df","quantity":"temperature","unit":"K","values":[[[300],[301],[302],[303]],[[300],[301],[302],[303]]]},{"components":["x","y","z"],"entity_ids":["12345678-1234-4000-8000-000000000001","12345678-1234-4000-8000-000000000002","12345678-1234-4000-8000-000000000003","12345678-1234-4000-8000-000000000004"],"frame_id":"12345678-1234-4000-8000-000000000014","location":"mesh_vertex","projection":"raw","provenance":"56e358a8af453fb0775c5e1ac4dc3c9c0b396ab2e7f3fc8c72813ac948bc76df","quantity":"heat_flux","unit":"W/m2","values":[[[2,3,8],[2,3,8],[2,3,8],[2,3,8]],[[2,3,8],[2,3,8],[2,3,8],[2,3,8]]]}],"frames":[{"basis":[[0,-1,0],[1,0,0],[0,0,1]],"id":"12345678-1234-4000-8000-000000000014"}],"id":"12345678-1234-4000-8000-000000000032","mappings":[{"area_m2":0.5,"from_id":"12345678-1234-4000-8000-00000000001e","from_kind":"cad_face","provenance":"56e358a8af453fb0775c5e1ac4dc3c9c0b396ab2e7f3fc8c72813ac948bc76df","to_id":"12345678-1234-4000-8000-00000000000b","to_kind":"facet","weight":1},{"area_m2":1,"from_id":"12345678-1234-4000-8000-00000000000a","from_kind":"element","provenance":"56e358a8af453fb0775c5e1ac4dc3c9c0b396ab2e7f3fc8c72813ac948bc76df","to_id":"12345678-1234-4000-8000-00000000001f","to_kind":"thermal_node","weight":1}],"material":{"conductivity":[[2,0,0],[0,3,0],[0,0,4]],"conductivity_unit":"W/(m*K)","density":1000,"density_unit":"kg/m3","frame_id":"12345678-1234-4000-8000-000000000014","specific_heat":500,"specific_heat_unit":"J/(kg*K)"},"mesh_revision":"07ce97d331da83deb58a0772ce36cbb0c42f2d16ce0df3129ba2be8d40f90484","minimum_reader":"2.0.0","model_hash":"38cec72cd7591611fb3e7a97c19e52cfa0416906f8566547d658dcc8a42662c0","project_id":"00000000-0000-4000-8000-000000000001","source_license_hash":"56e358a8af453fb0775c5e1ac4dc3c9c0b396ab2e7f3fc8c72813ac948bc76df","thermal_node_ids":["12345678-1234-4000-8000-00000000001f"],"times":[0,1],"vertex_ids":["12345678-1234-4000-8000-000000000001","12345678-1234-4000-8000-000000000002","12345678-1234-4000-8000-000000000003","12345678-1234-4000-8000-000000000004"],"vertices":[[0,0,0],[1,0,0],[0,1,0],[0,0,1]]}
